{
    "$schema": "http://json-schema.org/draft-04/schema",
    "additionalProperties": false,
    "properties": {
        "author": {
            "type": "string"
        },
        "createdAt": {
            "format": "date-time",
            "pattern": "^\\d{4}-\\d{2}-\\d{2}T\\d{2}:\\d{2}:\\d{2}Z$",
            "type": "string"
        },
        "createdBy": {
            "type": "string"
        },
        "date": {
            "format": "date-time",
            "pattern": "^\\d{4}-\\d{2}-\\d{2}T\\d{2}:\\d{2}:\\d{2}Z$",
            "type": "string"
        },
        "image": {
            "format": "uri",
            "type": "string"
        },
        "isCorporateBlog": {
            "default": false,
            "type": "boolean"
        },
        "primaryKey": {
            "$ref": "definitions.json/key/mention"
        },
        "title": {
            "type": "string"
        },
        "type": {
            "enum": [
                "attachment",
                "blogPost",
                "book",
                "bookSection",
                "computerProgram",
                "conferencePaper",
                "document",
                "interview",
                "journalArticle",
                "magazineArticle",
                "manuscript",
                "newspaperArticle",
                "note",
                "presentation",
                "radioBroadcast",
                "report",
                "thesis",
                "videoRecording",
                "webpage"
            ],
            "type": "string"
        },
        "updatedAt": {
            "format": "date-time",
            "pattern": "^\\d{4}-\\d{2}-\\d{2}T\\d{2}:\\d{2}:\\d{2}Z$",
            "type": "string"
        },
        "updatedBy": {
            "type": "string"
        },
        "url": {
            "format": "uri",
            "type": "string"
        },
        "version": {
            "type": "number"
        },
        "zoteroKey": {
            "type": "string"
        }
    },
    "required": [
        "createdAt",
        "isCorporateBlog",
        "primaryKey",
        "title",
        "type",
        "updatedAt"
    ],
    "title": "Mention schema"
}