[
  {
    "primaryKey": {
      "collection": "mention",
      "id": "4SVMY3V9"
    },
    "version": 2407,
    "title": "Reading news, visually",
    "type": "blogPost",
    "zoteroKey": "4SVMY3V9",
    "isCorporateBlog": true,
    "date": "2017-08-07T00:00:00Z",
    "url": "https://blog.esciencecenter.nl/reading-news-visually-6e02ea9468e",
    "author": "Maarten van Meersbergen",
    "image": "https://cdn-images-1.medium.com/max/2000/1*36VvqJkQdxzrbozNMfi0og.png",
    "createdAt": "2018-04-20T11:38:00Z",
    "updatedAt": "2018-04-20T11:38:00Z",
    "createdBy": "Scraper",
    "updatedBy": "Scraper"
  }
]
